Cult Beauty;Cult Beauty Advent Calendar 2020;£;199.00;Contents include:VOTARY – full size Super Seed Facial Oil (50ml)Living Proof – travel size Perfect Hair Day Triple Detox Shampoo (60ml)Hourglass – travel size Ambient Lighting Blush in ‘Luminous Flush’ (1.3g)Oskia – full size Liquid Mask Lactic Acid Micro-Peel (30ml)Verso – full size Eye Cream (20ml)Herbivore – deluxe Prism Exfoliating Glow Serum 12% (10ml)MALIN + GOETZ – travel size Vitamin b5 Body Moisturizer (30ml)de Mamiel – full size Settle (10ml)Dr. Barbara Sturm – deluxe Night Serum (10ml)MOLTON BROWN – travel size Delicious Rhubarb & Rose Bath & Shower Gel (100ml)Allies of Skin – deluxe 20% Vitamin C Brighten & Firm Serum (8ml)Costa Brazil – travel size Óleo Para O Corpo - Kaya Jungle Firming Body Oil (30ml)Algenist – full size Alive Prebiotic Balancing Mask (50ml)Drunk Elephant – deluxe Virgin Marula Luxury Facial Oil (8ml)Augustinus Bader – full size discovery size The Rich Cream (15ml)Glow Recipe – travel size Banana Soufflê Moisture Cream (25ml)111SKIN – travel size Rose Gold Radiance Booster (10ml)Too Faced – travel size Lip Injection Extreme (1.4ml)IT Cosmetics – deluxe Superhero Mascara (5ml)BY TERRY – travel size Ombre Blackstar in ‘Bronze Moon’ (0.9g)Natasha Denona – full size Bloom Highlighting Blush (4g)Dr. Dennis Gross Skincare – deluxe B3 Adaptive Superfoods Stress Rescue Super Serum (15ml)Susanne Kaufmann – travel size Pillow Spray Calming (75ml)Jordan Samuel Skin – full size Retinol Treatment Oil (30ml)Charlotte Tilbury – full size K.I.S.S.I.N.G Lipstick in ‘Stoned Rose’ (3.5g)Jo Loves – travel size Fig Tree Votive Candle (70g)Patchology – full size Little Helper Energy Dietary Supplement Strips (6 x 0.1g)Larry King Hair Care – travel size A Social Life for Your Hair (30ml)Huda Beauty – full size Topaz Obsessions Palette (10g)Milk Makeup – deluxe Lip & Cheek in ‘Werk’ (3g)Nudestix – full size Intense Matte Lip + Cheek Pencil in ‘Belle’ (2.49g)SUMMER FRIDAYS – full size Overtime Mask (64g)Cult Beauty – Beauty Banks £15/€17 Charity Contribution


The Ordinary;Niacinamide 10% + Zinc 1%;£;5.00;Aqua (Water), Niacinamide, Pentylene Glycol, Zinc PCA, Dimethyl Isosorbide, Tamarindus Indica Seed Gum, Xanthan gum, Isoceteth-20, Ethoxydiglycol, Phenoxyethanol, Chlorphenesin.


PAULA'S CHOICE;Skin Perfecting 2% BHA Liquid Exfoliant;£;10.00;Aqua, Methylpropanediol (hydration), Butylene Glycol (hydration), Salicylic Acid (Beta Hydroxy Acid, exfoliant), Polysorbate 20 (stabilizer), Camellia Oleifera (Green Tea) Leaf Extract (skin calming/antioxidant), Sodium Hydroxide (pH balancer), Tetrasodium EDTA (stabilizer).


The Ordinary;AHA 30% + BHA 2% Peeling Solution;£;6.30;Glycolic Acid, Aqua (Water), Aloe Barbadensis Leaf Water, Sodium Hydroxide, Daucus Carota Sativa Extract, Propanediol, Cocamidopropyl Dimethylamine, Salicylic Acid, Lactic Acid, Tartaric Acid, Citric Acid, Panthenol, Sodium Hyaluronate Crosspolymer, Tasmannia Lanceolata Fruit/Leaf Extract, Glycerin, Pentylene Glycol, Xanthan gum, Polysorbate 20, Trisodium Ethylenediamine Disuccinate, Potassium Sorbate, Sodium Benzoate, Ethylhexylglycerin, 1,2-Hexanediol, Caprylyl Glycol.  


THE INKEY LIST;Niacinamide;£;6.99;Water (Aqua/ Eau), Niacinamide, Glycerin, Propanediol, Butylene Glycol, Squalane, Leuconostoc/Radish Root Ferment Filtrate, Hyaluronic Acid, Phenoxyethanol, Hydroxyethyl Acrylate/Sodium Acryloyldimethyl Taurate Copolymer, Hydroxyethylcellulose, Phospholipids, Xanthan Gum, Glycine Soja (Soybean) Extract, Allantoin, Disodium Edta, Polysorbate 60, Panthenol, Glycolipids, Glycine Soja (Soybean) Sterol, Disodium Phosphate, Citric Acid, Sodium Phosphate.


The Ordinary;Glycolic Acid 7% Toning Solution;£;6.80;Aqua (Water), Glycolic Acid, Rosa damascena flower water, Centaurea cyanus flower water, Aloe Barbadensis Leaf Water, Propanediol, Glycerin, Triethanolamine, Aminomethyl Propanol, Panax Ginseng Root Extract, Tasmannia Lanceolata Fruit/Leaf Extract, Aspartic Acid, Alanine, Glycine, Serine, Valine, Isoleucine, Proline, Threonine, Histidine, Phenylalanine, Glutamic Acid, Arginine, PCA, Sodium PCA, Sodium Lactate, Fructose, Glucose, Sucrose, Urea, Hexyl Nicotinate, Dextrin, Citric Acid, Polysorbate 20, Gellan Gum, Trisodium Ethylenediamine Disuccinate, Sodium Chloride, Hexylene Glycol, Potassium Sorbate, Sodium Benzoate, 1,2-Hexanediol, Caprylyl Glycol.


fresh;Soy Face Cleanser;£;11.50;Aqua (Water), Coco-Glucoside, Glycerin, Butylene Glycol, PEG-7 Glyceryl Cocoate, Xanthan Gum, Glycine Soja (Soybean) Oil, Helianthus Annuus (Sunflower) Seed Oil, Borago Officinalis Seed Oil, Aloe Barbadensis Leaf Juice, Cucumis Sativus (Cucumber) Fruit Extract, Rosa Damascena Extract, Rosa Damascena Flower Water, Centaurea Cyanus Flower Extract, Glycine Soja (Soybean) Sterols, Panax Ginseng Root Extract, Rosa Damascena Flower Oil, Malva Sylvestris (Mallow) Flower Extract, Tocopherol, Ascorbyl Palmitate, PEG-120 Methyl Glucose Dioleate, PEG-40 Hydrogenated Castor Oil, Caprylyl Glycol, Polysorbate 20, Caprylic/Capric Triglyceride, Silica, Benzoic Acid, Disodium EDTA, Citric Acid, Behenyl Alcohol, Glyceryl Stearate, Lecithin, Pentylene Glycol, Hydrolyzed Soy Protein, Caramel, Sodium Benzoate, Potassium Sorbate, Phenoxyethanol <12424/A> Fresh product ingredient listings are updated periodically. Before using a fresh product, please read the ingredient list on the packaging of your product to be sure that the ingredients are appropriate for your personal use.


THE INKEY LIST;Retinol Serum;£;9.99;Water (Aqua / Eau), Glycerin, Butylene Glycol, Propanediol, Dicaprylyl Carbonate, Dimethicone, Retinol, Hydroxyethyl Acrylate/Sodium Acryloyldimethyl Taurate Copolymer, Caprylyl Glycol, Phospholipids, Caprylic/capric Glycerides, Squalane, Dimethyl Isosorbide, Glycine Soja (Soybean) Extract, Carbomer, Sodium Ascorbate, Tocopherol, Polysorbate 60, Tocopheryl Acetate, Glycolipids, Sodium Hydroxide, Disodium Edta, Hydroxypinacolone Retinoate, Glycine Soja (Soybean) Sterol, Leuconostoc/Radish Root Ferment Filtrate, Peg-40 Hydrogenated Castor Oil, Hyaluronic Acid, Polysorbate 20, Palmitoyl Tetrapeptide-7, Palmitoyl Tripeptide-1, Phenoxyethanol


THE INKEY LIST;Hyaluronic Acid Serum;£;5.99;Water (Aqua / Eau), Propanediol, Glycerin, Butylene Glycol, Sodium Hyaluronate, Ammonium Acryloyldimethyltaurate/Vp Copolymer, Leuconostoc/Radish Root Ferment Filtrate, Hyaluronic Acid, Carbomer, Polysorbate 20, Palmitoyl Tetrapeptide-7, Palmitoyl Tripeptide-1, Phenoxyethanol


THE INKEY LIST;Salicylic Acid Cleanser;£;10.99;Aqua (Water), Glycerin, Sodium Methyl Cocoyl Taurate, Cocamidopropyl Betaine, Cocamidopropyl Dimethylamine, PEG-120 Methyl Glucose Dioleate, Salicylic Acid, Betaine, Zinc PCA, Phenoxyethanol, Sodium Chloride, Allantoin, Coco-Glucoside, Glyceryl Oleate, Benzyl Alcohol, Coconut Acid, Ethylhexylglycerin, Sodium Benzoate, Citric Acid, Dehydroacetic Acid, Trisodium Ethylenediamine Disuccinate, Tocopherol, Hydrogenated Palm Glycerides Citrate.  


Pixi;Glow Tonic;£;10.00;Water/Aqua/Eau, Aloe Barbadensis Leaf Juice, Glycolic Acid, Butylene Glycol, Glycerin, Sodium Hydroxide, Hamamelis Virginiana (Witch Hazel) Leaf Extract, Aesculus Hippocastanum (Horse Chestnut) Seed Extract, Hexylene Glycol, Fructose, Glucose, Sucrose, Urea, Dextrin, Alanine, Glutamic Acid, Aspartic Acid, Hexyl Nicotinate, Panax Ginseng Root Extract, Ethylhexylglycerin, Disodium EDTA, Biotin, Panthenol, PPG-26-Buteth-26, PEG-40 Hydrogenated Castor Oil, Phenoxyethanol, Fragrance (Parfum), Caramel, Red 4 (CI 14700)


The Ordinary;Hyaluronic Acid 2% + B5;£;5.90;Aqua (Water), Sodium Hyaluronate, Sodium Hyaluronate Crosspolymer, Panthenol, Ahnfeltia Concinna Extract, Glycerin, Pentylene Glycol, Propanediol, Polyacrylate Crosspolymer-6, Ppg-26-Buteth-26, Trisodium Ethylenediamine Disuccinate, Citric Acid, Ethoxydiglycol, Caprylyl Glycol, Hexylene Glycol, Ethylhexylglycerin, Phenoxyethanol, Chlorphenesin


fresh;Rose Deep Hydration Face Cream;£;13.00;Aqua (Water), Glycerin, Ethylhexyl Isononanoate, Butylene Glycol, Pentylene Glycol, Propanediol, Caprylyl Methicone, Isostearyl Isostearate, Dimethicone, Behenyl Alcohol, Nylon-6/12, Steareth-2, Xanthan Gum, Prunus Domestica Seed Oil, Rosa Damascena Flower Water, Algin, Angelica Keiskei Extract, Acacia Senegal Gum, Cucumis Sativus (Cucumber) Fruit Extract, Rosa Damascena Flower Oil, Sodium Hyaluronate, Tocopheryl Acetate, Ammonium Acryloyldimethyltaurate/Vp Copolymer, Steareth-21, Polyacrylamide, C13-14 Isoparaffin, Acrylates/C10-30 Alkyl Acrylate Crosspolymer, Tromethamine, Dimethiconol, Laureth-7, Tetrasodium EDTA, Caprylic/Capric Triglyceride, BHT, Caramel, Serine, Parfum (Fragrance), Phenoxyethanol, Citronellol, GeraniolFresh product ingredient listings are updated periodically. Before using a fresh product, please read the ingredient list on the packaging of your product to be sure that the ingredients are appropriate for your personal use.


Wishful;Yo Glow Enzyme Scrub;£;18.00;Water/Aqua/Eau, Cellulose, Butylene Glycol, Propylene Glycol, Alcohol, 1,2-Hexanediol, Bromelain, Ananas Sativus (Pineapple) Fruit Extract, Papain, Carica Papaya (Papaya) Fruit Extract, Citric Acid, Lactic Acid, Malic Acid, Salicylic Acid, Tartaric Acid, Glycolic Acid, Zingiber Officinale (Ginger) Root Extract, Glycerin, Rosa Centifolia (Rose) Flower Extract, Cocos Nucifera (Coconut) Fruit Extract, Prunus Amygdalus Dulcis (Sweet Almond) Oil, Salix Alba (Willow) Bark Extract, Saccharum Officinarum (Sugar Cane) Extract/Saccharum Officinarum/Extrait de Canne à Sucre, Acer Saccharum (Sugar Maple) Extract, Camellia Japonica (Camellia) Leaf Extract, Citrus Paradisi (Grapefruit) Seed Extract, Phellodendron Amurense (Cork Tree) Bark Extract, Mannitol, Psidium Guajava (Guava) Leaf Extract, Camellia Sinensis (Tea Plant) Leaf Extract, Mangifera Indica (Mango) Fruit Extract, Musa Sapientum (Banana) Fruit Extract, Passiflora Edulis (Passionfruit) Fruit Extract, Citrus Aurantium Dulcis (Orange) Fruit Extract, Citrus Limon (Lemon) Fruit Extract, Vaccinium Myrtillus (Blueberry) Fruit Extract, Magnolia Officinalis (Magnolia) Bark Extract, Sodium Hyaluronate, Ethyl Hexylglycerin, Gluconolactone, Polysorbate 20, Carbomer, Tromethamine, Propanediol, Disodium EDTA, Phenoxyethanol, Benzyl Alcohol, Fragrance/Parfum  


The Ordinary;Azelaic Acid Suspension 10%;£;5.50;Aqua (Water), Isodecyl Neopentanoate, Dimethicone, Azelaic Acid, Dimethicone/Bis-Isobutyl PPG-20 Crosspolymer, Dimethyl Isosorbide, Hydroxyethyl Acrylate/Sodium Acryloyldimethyl Taurate Copolymer, Polysilicone-11, Isohexadecane, Tocopherol, Trisodium Ethylenediamine Disuccinate, Isoceteth-20, Polysorbate 60, Triethanolamine, Ethoxydiglycol, Phenoxyethanol, Chlorphenesin


Glow Recipe;Fruit Babies;£;26.00;Watermelon Glow Sleeping Mask (5ml): Aqua, Glycerin, Sodium Hyaluronate, Caulerpa Lentillifera Extract, Simethicone, Citrullus Lanatus Fruit Extract, Silica, Propanediol, Glycolic Acid, Lactic Acid, Cucurbita Pepo Fruit Extract, Punica Granatum Fruit Extract, Musa Sapientum Fruit Extract, Paeonia Suffruticosa Root Extract, Glycyrrhiza Glabra Root Extract, Brassica Oleracea Capitata Leaf Extract, Ipomoea Batatas Root Extract, Scutellaria Baicalensis Root Extract, Betaine, Beta-Glucan, Hydroxyethylcellulose, Xanthan Gum, Alcohol, Butylene Glycol, 1,2-Hexanediol, Benzyl Benzoate, Limonene, Parfum.Blueberry Bounce Gentle Cleanser (10ml): Aqua, Decyl Glucoside, Caulerpa Lentillifera Extract, Beta-Glucan, Sodium Hyaluronate, Vaccinium Angustifolium Fruit, Glycolic Acid, Lactic Acid, Physalis Peruviana Fruit Extract, Rubus Idaeus Fruit, Arctostaphylos Uva-Ursi Leaf Extract, Morus Nigra Fruit Extract, Vaccinium Myrtillus Fruit Extract, Scutellaria Baicalensis Root Extract, Paeonia Suffruticosa Root Extract, Glycyrrhiza Glabra Root Extract, Betaine, Sodium Chloride, Glycerin, 1,2-Hexanediol, Butylene Glycol, Butylphenyl Methylpropional, Hexyl Cinnamal, Citronellol, Linalool, Parfum.Watermelon Glow Pink Juice Moisturizer (7ml): Aqua, Glycerin, Propanediol, Cetearyl Alcohol, Glyceryl Stearate, Persea Gratissima Oil, C9-12 Alkane, Stearic Acid, Butyrospermum Parkii Butter, Kaolin, Sodium Lauroyl Glutamate, Persea Gratissima Fruit Extract, Squalane, Niacinamide, Malachite Extract, Ethylhexylglycerin, Hexylresorcinol, Oryza Sativa Extract, Tocopheryl Acetate, Aloe Barbadensis Leaf Juice, Coffea Arabica Fruit Extract, Hyaluronic Acid, Ethylhexyl Palmitate, Sodium Hyaluronate, Retinol, PEI-10, Hydrated Silica, Sodium Chloride, Fructan, Maltodextrin, Spirulina Maxima Extract, CI 75300, Potassium Chloride, Potassium Phosphate, Butylene Glycol, Sodium Phosphate, Hydrogenated Starch Hydrolysate, Maltooligosyl Glucoside, Arginine, Silica Dimethyl Silylate, Sodium Dilauramidoglutamide Lysine, Sodium Hydroxide, Citric Acid, Caprylyl Glycol, Carthamus Tinctorius Seed Extract, Lavandula Angustifolia Flower/Leaf/Stem Extract, Rosmarinus Officinalis Leaf Extract, PPG-3 Benzyl Ether Myristate, Polyisobutene, PVP, C13-15 Alkane, Acrylates/C10-30 Alkyl Acrylate Crosspolymer, Sodium Hydroxypropylsulfonate Laurylglucoside Crosspolymer, Parfum, Hexylene Glycol, Potassium Sorbate, Sodium Benzoate, Phenoxyethanol.Watermelon Glow PHA + BHA Pore-Tight Toner (10ml): Opuntia Ficus-Indica (Cactus) Extract, Citrullus Lanatus (Watermelon) Extract, Glycerin, Hyaluronic Acid, Aqua, Gluconolactone, Sodium Polyglutamate, Betaine Salicylate, Salix Alba (Willow) Bark Extract, Melaleuca Alternifolia (Tea Tree) Extract, Hibiscus Sabdariffa Flower Water, Watermelon, Lactobacillus, Cucumis Sativus (Cucumber) Fruit Extract, Saccharum Officinarum (Sugarcane) Extract, Glycyrrhiza Glabra (Licorice) Root Extract, Scutellaria Baicalensis Root Extract, Paeonia Suffruticosa Root Extract, Brassica Oleracea Capitata (Cabbage) Leaf Extract, Ipomoea Batatas Root Extract, Sorbitan Oleate, Levulinic Acid, Sodium Levulinate, Molasses, Benzyl Benzoate, Limonene, Parfum.Avocado Melt Retinol Eye Sleeping Mask (5ml): Aqua, Glycerin, Propanediol, Cetearyl Alcohol, Glyceryl Stearate, Persea Gratissima Oil, C9-12 Alkane, Stearic Acid, Butyrospermum Parkii Butter, Kaolin, Sodium Lauroyl Glutamate, Persea Gratissima Fruit Extract, Squalane, Niacinamide, Malachite Extract, Ethylhexylglycerin, Hexylresorcinol, Oryza Sativa Extract, Tocopheryl Acetate, Aloe Barbadensis Leaf Juice, Coffea Arabica Fruit Extract, Hyaluronic Acid, Ethylhexyl Palmitate, Sodium Hyaluronate, Retinol, PEI-10, Hydrated Silica, Sodium Chloride, Fructan, Maltodextrin, Spirulina Maxima Extract, CI 75300, Potassium Chloride, Potassium Phosphate, Butylene Glycol, Sodium Phosphate, Hydrogenated Starch Hydrolysate, Maltooligosyl Glucoside, Arginine, Silica Dimethyl Silylate, Sodium Dilauramidoglutamide Lysine, Sodium Hydroxide, Citric Acid, Caprylyl Glycol, Carthamus Tinctorius Seed Extract, Lavandula Angustifolia Flower/Leaf/Stem Extract, Rosmarinus Officinalis Leaf Extract, PPG-3 Benzyl Ether Myristate, Polyisobutene, PVP, C13-15 Alkane, Acrylates/C10-30 Alkyl Acrylate Crosspolymer, Sodium Hydroxypropylsulfonate Laurylglucoside Crosspolymer, Parfum, Hexylene Glycol, Potassium Sorbate, Sodium Benzoate, Phenoxyethanol.Banana Souffle Moisture Cream (3ml): Aqua, Glycerin, Coconut Alkanes, Squalane, Pentylene Glycol, Propanediol, Butylene Glycol, Cetearyl Alcohol, Simmondsia Chinensis Seed Oil, Musa Sapientum Water, Magnesium PCA, Centella Asiatica Extract, Curcuma Longa Root Extract, Salvia Miltiorrhiza Root Extract, Bisabolol, Sodium Hyaluronate, Salvia Hispanica Seed Extract, Cocos Nucifera Fruit Extract, Melia Azadirachta Flower Extract, Melia Azadirachta Leaf Extract, Althaea Officinalis Root Extract, Ocimum Sanctum Leaf Extract, Corallina Officinalis Extract, Ocimum Basilicum Flower/Leaf Extract, Aloe Barbadensis Leaf Juice, Capryloyl Glycerin/Sebacic Acid Copolymer, Acrylates/C10-30 Alkyl Acrylate Crosspolymer, Coco-Caprylate/Caprate, Diheptyl Succinate, Caprylyl Glycol, Ethylhexylglycerin, Hexylene Glycol, Xanthan Gum, Hydroxyethyl Acrylate/Sodium Acryloyldimethyl Taurate Copolymer, Tetrasodium Glutamate Diacetate, Sodium Hydroxide, Phenoxyethanol, Polysorbate 60, Sorbitan Isostearate, Sodium Glycolate, Sodium Formate, Parfum*.*Natural Fragrance


THE INKEY LIST;Oat Cleansing Balm;£;9.99;Prunus Amygdalus Dulcis (Sweet Almond) Oil, Cetearyl Alcohol, PEG-6 Caprylic/Capric Glycerides, Avena Sativa (Oat) Kernel Oil, Candelilla Cera (Cire de candelilla), Silica, Sorbitan Stearate, Tribehenin, PEG-60 Almond Glycerides, Avena Sativa (Oat) Kernel Flour, Aqua (Water/Eau), Benzyl Alcohol, Phenoxyethanol, Lecithin, 1,2-Hexanediol, Ascorbyl Palmitate, Tocopherol, Biosaccharide Gum-4, Helianthus Annuus (Sunflower) Seed Oil.


Versed;Just Breathe Clarifying Serum;£;18.00;Water, Glycerin, Niacinamide, Salix Nigra (Willow) Bark Extract, Zinc Gluconate, Sodium Hyaluronate, Salicylic Acid, Aesculus Hippocastanum (Horse Chestnut) Seed Extract, 1,2-Hexanediol, Butylene Glycol, Phenoxyethanol, PEG-40 Hydrogenated Castor Oil, Hydroxyethylcellulose, Yeast Extract, Glyceryl Acrylate/Acrylic Acid Copolymer, Trisodium Ethylenediamine Disuccinate, Ammonium Glycyrrhizate, Biotin, Panthenol, Propylene Glycol, Caffeine.


Versed;Day Dissolve Cleansing Balm;£;7.50;Ethylhexyl Palmitate, Isopropyl Palmitate, PEG-20 Glyceryl Triisostearate, Polyethylene, Tocopheryl Acetate, Eucalyptus Globulus Leaf Oil, Eugenia Caryophyllus (Clove) Leaf Oil, Simmondsia Chinensis (Jojoba) Seed Oil, Persea Gratissima (Avocado) Oil, Prunus Armeniaca (Apricot) Kernel Oil, Sclerocarya Birrea Seed Oil, Sesamum Indicum (Sesame) Seed Oil, Butyl Methoxydibenzoylmethane, Caprylyl Glycol, Eugenol, Limonene.


The Ordinary;Natural Moisturizing Factors + HA;£;4.90;Aqua (Water), Caprylic/Capric Triglyceride, Cetyl Alcohol, Propanediol, Stearyl Alcohol, Glycerin, Sodium Hyaluronate, Arginine, Aspartic Acid, Glycine, Alanine, Serine, Valine, Isoleucine, Proline, Threonine, Histidine, Phenylalanine, Glucose, Maltose, Fructose, Trehalose, Sodium PCA, PCA, Sodium Lactate, Urea, Allantoin, Linoleic Acid, Oleic Acid, Phytosteryl Canola Glycerides, Palmitic Acid, Stearic Acid, Lecithin, Triolein, Tocopherol, Carbomer, Isoceteth-20, Polysorbate 60, Sodium Chloride, Citric Acid, Trisodium Ethylenediamine Disuccinate, Pentylene Glycol, Triethanolamine, Sodium Hydroxide, Phenoxyethanol, Chlorphenesin


THE INKEY LIST;Vitamin B, C and E Moisturizer;£;4.99;Aqua (Water/Eau), Glycerin, Glyceryl Stearate SE, Cetearyl Alcohol, Caprylic/Capric Triglyceride, Cocos Nucifera (Coconut) Oil, Stearic Acid, Phenoxyethanol, Benzyl Alcohol, Carbomer, Sodium Hydroxide, Niacinamide, Panthenol, Sodium Ascorbyl Phosphate, Sodium Hyaluronate, Tocopheryl Acetate, Ethylhexylglycerin, Dehydroacetic Acid, Lecithin, Trisodium Ethylenediamine Disuccinate, Ascorbyl Palmitate, Tocopherol, Helianthus Annuus (Sunflower) Seed Oil.


THE INKEY LIST;SPF 30 Daily Sunscreen;£;14.99;Water (Aqua/Eau), Zinc Oxide, Caprylic/Capric Triglyceride, Dicaprylyl Carbonate, Coconut Alkanes, Glyceryl Stearate, Caramel, Glycerin, Silica, PEG-100 Stearate, Polyhydroxystearic Acid, Dimethicone, Glyceryl Stearate Citrate, Polymethylsilsesquioxane/ Silica Crosspolymer, Potassium Cetyl Phosphate, Stearic Acid, Phenoxyethanol, Polyglyceryl-3 Stearate, Coco-Caprylate/Caprate, Sodium Stearoyl Glutamate, Hydrogenated Lecithin, Hydroxyethyl Acrylate/ Sodium Acryloyldimethyl Taurate Copolymer, Polysilicone-11, Squalane, Bisabolol, Butyrospermum Parkii (Shea) Butter, Tocopheryl Acetate, Xanthan Gum, Citric Acid, Aloe Barbadensis Leaf Juice Powder, Ethylhexylglycerin, Panthenol, Lecithin, Polysorbate 60, Trisodium Ethylenediamine Disuccinate, 1,2-Hexanediol, Tocopherol, Ascorbyl Palmitate, Sorbitan Isostearate, Biosaccharide Gum-4, Helianthus Annuus (Sunflower) Seed Oil.


Supergoop!;Unseen Sunscreen SPF 30;£;15.00;Active Ingredients: Avobenzone 3%, Homosalate 8%, Octisalate 5%, Octocrylene 4%Inactive Ingredients: Isododecane, Dimethicone Crosspolymer, Dimethicone/Bis-Isobutyl PPG-20 Crosspolymer, Polymethylsilsesquioxane, Isohexadecane, Dicaprylyl Carbonate, Meadowfoam Estolide, Caprylic/Capric Triglyceride, Polyester-7, Neopentyl Glycol Diheptanoate, Lithothamnion Calcareum Extract, Caprylyl Glycol, Butyrospermum Parkii (Shea) Butter, Jojoba Esters, Mannitol, Boswellia Serrata Resin Extract, Lecithin, Microcrystalline Cellulose, Diatomaceous Earth, Zinc Sulfate, Silica, Tocopherol


fresh;Mini Loves fresh Favourites Set;£;32.00;Black Tea Kombucha Facial Treatment Essence: Aqua (Water), Saccharomyces Ferment Filtrate, Glycerin, Camellia Sinensis Leaf Extract, Pentylene Glycol, Polyglycerin-3, Kigelia Africana Fruit Extract, Citrus Unshiu Peel Extract, Sodium Hyaluronate, Adenosine, Tocopheryl Acetate, Tocopherol, Butylene Glycol, Diglycerin, PEG-60 Hydrogenated Castor Oil, Sodium Benzoate, Parfum (Fragrance), Disodium EDTA, Hydroxyethylcellulose, Sodium Citrate, BHT, Citric Acid, Potassium Sorbate, Biotin, Phenoxyethanol, Linalool, Citronellol, GeraniolLotus Youth Preserve Moisturizer: Aqua (Water), Glycerin, Propylene Glycol Dicaprylate/Dicaprate, Pentylene Glycol, Cetearyl Alcohol, Caprylic/Capric Triglyceride, Cetearyl Isononanoate, Betaine, Polymethyl Methacrylate, Steareth-21, Ficus Carica (Fig) Fruit Extract, Lepidium Meyenii Root Extract, Citrus Limon (Lemon) Peel Oil, Cucumis Sativus (Cucumber) Fruit Extract, Algae Extract, Nelumbo Nucifera Flower Extract, Hibiscus Esculentus Fruit Extract, Sodium Hyaluronate, Tocopheryl Acetate, Ascorbyl Tetraisopalmitate, Tocopherol, Behenyl Alcohol, Cetearyl Glucoside, Sorbitol, Dimethicone, Sodium Pca, Caprylyl Glycol, Carbomer, Tromethamine, Cetyl Alcohol, Stearyl Alcohol, Butylene Glycol, Xanthan Gum, Caramel, Citric Acid, Potassium Sorbate, Sorbic Acid, Phenoxyethanol, Limonene, Citral <10953/A> Rose Face Mask: Aqua (Water), Butylene Glycol, Glycerin, Pentylene Glycol, PEG-60 Hydrogenated Castor Oil, Rosa Centifolia Flower, Rosa Damascena Flower Water, Rosa Damascena Extract, Cucumis Sativus (Cucumber) Fruit Extract, Anthemis Nobilis Flower Oil, Camellia Sinensis Leaf Extract, Porphyridium Cruentum Extract, Rosa Damascena Flower Oil, Aloe Barbadensis Leaf Extract, Aspalathus Linearis Leaf Extract, Faex (Yeast Extract), Tocopherol, Carbomer, Tetrasodium EDTA, Sodium Hydroxide, Maris Aqua (Sea Water), Caprylic/Capric Triglyceride, Glyceryl Acrylate/Acrylic Acid Copolymer, Sodium Hyaluronate, Caramel, Maltodextrin, Citric Acid, Sodium Benzoate, Potassium Sorbate, Phenoxyethanol, Citronellol, GeraniolSugar Advanced Therapy Treatment: Cera Alba (Beeswax), Simmondsia Chinensis (Jojoba) Seed Oil, C10-18 Triglycerides, Hydrogenated Olive Oil Decyl Esters, Ricinus Communis (Castor) Seed Oil, Vitis Vinifera (Grape) Seed Oil, Ethylhexyl Palmitate, Parfum (Fragrance), Theobroma Grandiflorum Seed Butter, Prunus Domestica Seed Oil, Copernicia Cerifera (Carnauba) Wax, Limnanthes Alba (Meadowfoam) Seed Oil, Hydrogenated Vegetable Oil, Passiflora Incarnata Seed Oil, Sucrose Tetrastearate Triacetate, Crithmum Maritimum Extract, Commiphora Mukul Resin Extract, Ribes Nigrum (Black Currant) Seed Oil, Tocopherol, Ascorbyl Tetraisopalmitate, Tocopheryl Acetate, Ascorbyl Palmitate, PEG-6 Isostearate, Caprylic/Capric Triglyceride, Ammonium Glycyrrhizate, Trihydroxystearin, Hesperetin Laurate, Vanillin, Butylene Glycol, BHT, Caprylyl Glycol, Sodium Hyaluronate, Hexylene Glycol, Phenoxyethanol, Limonene, Citral, Benzyl Alcohol, Linalool, GeraniolSoy Face Cleanser: Aqua (Water), Coco-Glucoside, Glycerin, Butylene Glycol, PEG-7 Glyceryl Cocoate, Xanthan Gum, Glycine Soja (Soybean) Oil, Helianthus Annuus (Sunflower) Seed Oil, Borago Officinalis Seed Oil, Aloe Barbadensis Leaf Juice, Cucumis Sativus (Cucumber) Fruit Extract, Rosa Damascena Extract, Rosa Damascena Flower Water, Centaurea Cyanus Flower Extract, Glycine Soja (Soybean) Sterols, Panax Ginseng Root Extract, Rosa Damascena Flower Oil, Malva Sylvestris (Mallow) Flower Extract, Tocopherol, Ascorbyl Palmitate, PEG-120 Methyl Glucose Dioleate, PEG-40 Hydrogenated Castor Oil, Caprylyl Glycol, Polysorbate 20, Caprylic/Capric Triglyceride, Silica, Benzoic Acid, Disodium EDTA, Citric Acid, Behenyl Alcohol, Glyceryl Stearate, Lecithin, Pentylene Glycol, Hydrolyzed Soy Protein, Caramel, Sodium Benzoate, Potassium Sorbate, Phenoxyethanol <12424/A> Fresh product ingredient listings are updated periodically. Before using a fresh product, please read the ingredient list on the packaging of your product to be sure that the ingredients are appropriate for your personal use.


Glow Recipe;Watermelon Glow Sleeping Mask;£;20.50;Aqua, Glycerin, Sodium Hyaluronate, Caulerpa Lentillifera Extract, Simethicone, Citrullus Lanatus Fruit Extract, Silica, Propanediol, Glycolic Acid, Lactic Acid, Cucurbita Pepo Fruit Extract, Punica Granatum Fruit Extract, Musa Sapientum Fruit Extract, Paeonia Suffruticosa Root Extract, Glycyrrhiza Glabra Root Extract, Brassica Oleracea Capitata Leaf Extract, Ipomoea Batatas Root Extract, Scutellaria Baicalensis Root Extract, Betaine, Beta-Glucan, Hydroxyethylcellulose, Xanthan Gum, Alcohol, Butylene Glycol, 1,2-Hexanediol, Benzyl Benzoate, Limonene, Parfum.


THE INKEY LIST;C-50 Blemish Night Treatment;£;12.99;Aqua (Water/ Eau), Propanediol, Sodium Ascorbyl Phosphate, Salicylic Acid, Ammonium Acryloyldimethyltaurate/VP Copolymer, Phenoxyethanol, Caprylyl/Capryl Glucoside, Xanthan Gum, Glycerin, Sodium Hydroxide, Madecassoside, Ethylhexylglycerin, Hydroxyacetophenone, Sodium Gluconate, Sodium Metabisulfite, Lecithin, Ascorbyl Palmitate, Nelumbo Nucifera Flower Extract, Nymphaea Coerulea Flower Extract, Tocopherol, Helianthus Annuus (Sunflower) Seed Oil.


